anglice,CEFR,genus,verbum,definitio,exemplum,interpretatio
"under, below",A1,preposition,sub,Infra aliquid positum.,Sub arbore sedeo.,I sit under the tree.
suburban,C,adjective,suburbanus,Ad oppidum iuxta urbem pertinens.,Vita suburbana saepe tranquilla est.,Suburban life is often peaceful.
be,A1,verb,"sum, esse",Exsistere aut vitam habere.,Sum puer.,I am a boy.
"on, over, above",A1,adjective,super,Supra aliquid positum.,Super montem est.,It is above the mountain.
phone,C,neuter,telephonum,Instrumentum vocale ad longinquum.,Telephonum longinqua verba transmittit.,The phone transmits words across distance.
TV,C,feminine,televisio,Instrumentum quod imagines transmitit.,Televisio imagines domum affert.,Television brings images into the home.
"temporal, temporary",B2,adjective,temporalis,Ad tempus breve pertinens.,Bellum temporale cito finitur.,A temporary war ends quickly.
time,A1,neuter,tempus,Spatium in quo res aguntur.,Tempus fugit.,Time flies.
train,C,neuter,tramen,Currus ferreus qui per vias currit.,Tramen celeriter per campos fertur.,The train is carried swiftly across the fields.
across,A1,preposition,trans,De uno latere in aliud ire.,Trans viam ambulo.,I walk across the street.
"transit, transition",C,feminine,transitio,Transitus de uno statu ad alium.,Transitio regiminis difficilis fuit.,The transition of government was difficult.
transplant,C,verb,"transplanto, transplantare",Partem corporis in alium transferre.,Medicus cor transplantare temptavit.,The doctor attempted to transplant a heart.
then,A1,,tum,Tempus quod sequitur.,Tum venio.,Then I come.
then,A2,,tunc,Tempus praeteritum indicans.,Tunc omnes tacuerunt.,Then all were silent.
where,A1,,ubi,Locus in quo aliquid est.,Ubi es?,Where are you?
universal,B2,adjective,universalis,Quod ad omnia valet.,Lex universalis aequitatem promittit.,A universal law promises fairness.
university,C,feminine,universitas,Locus ubi disciplinae altiores traduntur.,Universitas multos discipulos erudit.,The university educates many students.
"whole, entire",B2,adjective,universus,Qui totum complectitur.,Universus exercitus in acie stetit.,The entire army stood in battle line.
one,A1,numeral,unus,Numerus primus.,Unus liber est.,There is one book.
urban,B2,adjective,urbanus,Ad urbem pertinens.,Vita urbana saepe plena est strepitu.,Urban life is often full of noise.
city,A1,feminine,urbs,Locus magnus ubi multi habitant.,Urbs magna est.,The city is large.
that,A1,,ut,Indicium causae vel finis.,Dico ut facias.,I say so that you may do.
"be strong, be valid",A2,verb,"valeo, valere",Magna vi et sanitate uti.,Post morbum iterum valeo.,After illness I am strong again.
"strong, valid",A2,adjective,validus,Qui validam vim habet.,Miles validus arma fert.,The strong soldier carries weapons.
steam,B2,masculine,vapor,Aer calidus qui ex liquido surgit.,Vapor ex aqua fervente oritur.,Steam rises from boiling water.
various,A2,adjective,varius,Multa et diversa ostendens.,In foro sunt homines varii.,In the forum there are various people.
vehicle,B1,neuter,vehiculum,Instrumentum quod homines aut res portat.,Vehiculum equis trahitur per viam.,The vehicle is drawn by horses along the road.
carry,A2,verb,"veho, vehere",Onus in curru aut nave portare.,Mercator merces in navem vehit.,The merchant carries goods into the ship.
"or, even",A2,conjunction,vel,"Particula quae alteram rem ponit, etiam utramque sinit.",Magister librum vel tabulam legere iubet.,The teacher orders us to read a book or a tablet.
come,A1,verb,"venio, venire",De loco alieno ad hunc locum venire.,Romam venio.,I come to Rome.
word,A1,neuter,verbum ,Vox quae sensum exprimit.,Verbum dico.,I speak a word.
truth,A2,feminine,vertitas,Id quod verum est.,Philosophus semper amat veritatem.,The philosopher always loves the truth.
"true, real",A1,adjective,verus,Qui sine mendacio est.,Verus amicus est.,He is a true friend.
undertaker,C,masculine,vespillo ,Is qui mortuos sepelit.,Vespillo corpora nocte portat.,The undertaker carries bodies at night.
see,A1,verb,"video, videre",Oculis intueri.,Te video.,I see you.
"win, conquer",A1,verb,"vinco, vincere",Hostem superare aut maiorem vim habere.,Hostem vinco.,I conquer the enemy.
man,A1,masculine,vir,Masculus adultus.,Vir fortis est.,The man is brave.
manly,A2,adjective,virilis,Qui virum decet.,Miles virilis est.,The soldier is manly.
"manliness, virtue",A2,feminine,virtus,Virtus animi et fortitudo.,Virtus magna est in virtute Romana.,Great strength is in Roman virtue.
life,A1,feminine,vita,Spatium vitae hominis aut animalis.,Vita bona est.,Life is good.
vital,B2,adjective,vitalis,Ad vitam necessarius.,Aqua est pars vitalis vitae humanae.,Water is a vital part of human life.
live,A1,verb,"vivo, vivere",Spiritum ducere et vitam agere.,Vivo bene.,I live well.
"want, wish",A1,verb,"volo, velle",Optare aut desiderare.,Volo ludere.,I want to play.
voice,A1,feminine,vox,Sonus a ore hominis vel animali profectus.,Vox clara auditur.,A clear voice is heard.